{
  "$schema": "https://conventionalcomments.io/schema/v1.json",
  "version": 1,
  "mode": "enforce",
  "labels": [
    { "id": "issue", "enabled": true, "blockingByDefault": true, "alwaysNonBlocking": false, "icon": "🔨", "color": "#E04E45", "aliases": ["bug"] },
    { "id": "typo", "enabled": false }
  ],
  "decorations": {
    "allowFree": true,
    "known": [
      { "id": "blocking", "forces": "blocking" },
      { "id": "if-minor", "forces": "non-blocking" },
      { "id": "security", "forces": null }
    ]
  },
  "severities": { "W-MISSING-DECORATION": "off", "E-CONFLICT": "error" },
  "scope": { "validateReplies": false, "validateReviewSummary": true },
  "rules": { "minSubjectLength": 5, "maxSubjectLength": 120, "minDecisionSubjectLength": 20 },
  "formatSeverity": "warn",
  "exemptUsers": ["dependabot[bot]"],
  "allowlistPatterns": ["^LGTM$"],
  "toolCommands": ["/*", "@dependabot", "@renovate"],
  "resolverOverrideGroup": ["acme/tech-leads"],
  "overrideLabel": "cc-override",
  "activation": { "activatedAt": "2026-09-01T00:00:00Z" },
  "configUrl": null,
  "coreMinVersion": "1.0.0",
  "configCacheTtlSeconds": 3600,
  "badgeStyle": "pill",
  "shortcuts": { "abbreviations": { "?i": "issue: " } },
  "docUrl": "https://conventionalcomments.org/",
  "server": { "coalesceWindowSeconds": 10, "gracePeriodSeconds": 900, "reconcileIntervalSeconds": 60, "statusTargetUrl": null },
  "exemptionLog": { "endpoint": null },
  "language": "fr",
  "telemetry": { "enabled": false, "endpoint": null }
}
